{
  "act_id": "demo.act.adopt.surface.sli-correction.v1",
  "actor": "demo.user.filer",
  "at": "2026-10-08T00:00:00Z",
  "committed_against": 1,
  "kind": "surface-adoption",
  "payload": {
    "audit": {
      "note": "synthetic SLI correction-session surface; non-authoritative"
    },
    "package": {
      "checksum": "cd79723bf8c9c02802083ed719ab91d2f783cc4d96abddf362c7ec7ed9c5cdc2",
      "id": "demo.surface.sli-correction",
      "version": "v1"
    },
    "release": {
      "checksum": "162fc8e4a59266591b7f604b2ad36b0c9a2678287e2203d2ae5f4a64e374479a",
      "id": "demo.surface-release.sli-correction.2025",
      "version": "v1"
    },
    "revision": 1,
    "scope": {
      "jurisdiction": "us",
      "year": "2025"
    }
  },
  "schema": "act.v1"
}
